{
  "$schema": "./schemas/v1-gate-ledger-v1.schema.json",
  "schemaVersion": 1,
  "kind": "open-rfc-v1-roadmap",
  "releaseContract": {
    "packageName": "open-rfc",
    "targetVersion": "1.0.0",
    "startingPoint": "published-0.x-beta-line",
    "baselineResolution": "Resolve the exact latest public 0.x release, source commit, npm artifact, support record, and retained pre-publication evidence when V1-00 begins; this planning ledger deliberately does not embed a moving latest-version claim.",
    "defaultScope": "Direct application-server classic RFC with password authentication, the stable standalone API, the archived node-rfc compatibility surface, and unchanged @sap/cds-rfc through the documented npm override.",
    "scopeRule": "Additional routes become 1.0 requirements only through an accepted scope decision that changes their releaseRequirement from conditional to required before the stable contract freezes.",
    "admissionRule": "A proposed, accepted, in-progress, blocked, or deferred roadmap state is never release evidence. Version 1.0 is admissible only after every required item is done against the same exact release candidate and its acceptance evidence is independently verified."
  },
  "statusVocabulary": [
    "proposed",
    "accepted",
    "in-progress",
    "blocked",
    "done",
    "deferred"
  ],
  "assessmentVocabulary": {
    "importance": [
      "critical",
      "high",
      "medium",
      "low"
    ],
    "risk": [
      "critical",
      "high",
      "medium",
      "low"
    ],
    "effort": [
      "XS",
      "S",
      "M",
      "L",
      "XL"
    ],
    "confidence": [
      "high",
      "medium",
      "low"
    ],
    "releaseRequirement": [
      "required",
      "conditional",
      "post-v1"
    ]
  },
  "estimateAssumptions": {
    "unit": "experienced-maintainer-person-days",
    "teamModel": "One experienced maintainer familiar with the current implementation, assisted by existing automation and independent reviewers or operators where named.",
    "existingAssets": "Current protocol implementation, beta harnesses, public release pipeline, documentation system, and historical evidence are reusable when their exact inputs remain valid.",
    "excludes": "Calendar wait for adopters, SAP operators, external reviewers, credentials, infrastructure capacity, and upstream specifications; conditional route implementation is excluded from the required total until selected.",
    "interpretation": "Ranges are planning estimates rather than commitments. Re-estimate an item whenever scope, evidence reuse, external availability, or a prerequisite changes materially."
  },
  "requiredOutcomeCoverage": [
    {
      "id": "consecutive-clean-candidates",
      "requirementIds": [
        "roadmap.v1-04.consecutive-release-candidates"
      ]
    },
    {
      "id": "stable-api-and-policies",
      "requirementIds": [
        "roadmap.v1-03.api-snapshot-freeze",
        "roadmap.v1-03.defaults-freeze",
        "roadmap.v1-03.semver-deprecation-policy",
        "roadmap.v1-03.support-eol-policy"
      ]
    },
    {
      "id": "twenty-four-hour-soaks",
      "requirementIds": [
        "roadmap.v1-04.twenty-four-hour-soaks"
      ]
    },
    {
      "id": "linux-node-consumers",
      "requirementIds": [
        "roadmap.v1-04.linux-node-consumer-matrix"
      ]
    },
    {
      "id": "production-like-adopters",
      "requirementIds": [
        "roadmap.v1-04.standalone-adopter",
        "roadmap.v1-04.node-rfc-adopter",
        "roadmap.v1-04.cap-adopter"
      ]
    },
    {
      "id": "reproducible-assurance",
      "requirementIds": [
        "roadmap.v1-05.reproducible-supply-chain",
        "roadmap.v1-05.independent-security-review",
        "roadmap.v1-05.independent-correctness-review",
        "roadmap.v1-05.findings-closure"
      ]
    },
    {
      "id": "operations-readiness",
      "requirementIds": [
        "roadmap.v1-05.operations-readiness"
      ]
    }
  ],
  "gates": [
    {
      "id": "V1-00",
      "title": "Rebaseline after public beta",
      "objective": "Replace pre-publication assumptions with one reviewed starting point for the published 0.x line and one maintained roadmap authority.",
      "dependsOn": [],
      "exitCriteria": [
        "The exact public baseline and retained pre-publication evidence are reconciled without relabeling evidence onto different bytes.",
        "The machine ledger, public roadmap, and issue workflow have one documented ownership and update rule.",
        "Every deferred beta requirement is mapped to a v1 item or deliberately excluded by a reviewed scope decision."
      ],
      "workItems": [
        {
          "id": "roadmap.v1-00.publication-rebaseline",
          "title": "Reconcile the published baseline",
          "summary": "Record which public 0.x release, source commit, npm artifact, documentation record, and retained evidence form the starting point for v1 planning.",
          "status": "proposed",
          "releaseRequirement": "required",
          "condition": null,
          "executionKind": "evidence",
          "importance": {
            "level": "critical",
            "rationale": "Every later estimate and acceptance decision is unreliable if it still assumes the pre-publication 0.2.0 candidate rather than the published line."
          },
          "risk": {
            "level": "medium",
            "summary": "Evidence from historical candidates can be mistaken for proof of later public bytes, creating false confidence and redundant reruns.",
            "domains": [
              "correctness",
              "supply-chain",
              "scope"
            ],
            "mitigations": [
              "Bind the baseline to exact source, artifact, release, and documentation identities.",
              "Classify retained evidence as reusable, diagnostic-only, or invalidated instead of copying pass labels."
            ]
          },
          "effort": {
            "size": "S",
            "personDays": {
              "minimum": 2,
              "maximum": 4
            },
            "confidence": "high",
            "drivers": "The public release records exist; the work is primarily identity reconciliation and deletion of stale publication assumptions."
          },
          "ownerKinds": [
            "maintainer",
            "release-owner"
          ],
          "dependsOn": [],
          "deliverables": [
            "Exact public baseline record",
            "Evidence reuse and invalidation map"
          ],
          "acceptanceCriteria": [
            "The baseline resolves one exact public source commit and npm/GitHub artifact identity.",
            "No evidence is credited to an artifact or commit other than the one it names.",
            "Pre-publication status prose is either corrected or clearly historical."
          ]
        },
        {
          "id": "roadmap.v1-00.roadmap-governance",
          "title": "Adopt roadmap governance",
          "summary": "Define how roadmap proposals become accepted work, how estimates change, and how reviewed items are mirrored into GitHub milestones or issues.",
          "status": "proposed",
          "releaseRequirement": "required",
          "condition": null,
          "executionKind": "policy",
          "importance": {
            "level": "high",
            "rationale": "A large roadmap without one update rule will immediately split into stale documents, issues, and evidence tracking queues."
          },
          "risk": {
            "level": "low",
            "summary": "The main risk is administrative drift rather than product failure, but drift can hide a release-critical dependency.",
            "domains": [
              "operations",
              "schedule"
            ],
            "mitigations": [
              "Keep this ledger authoritative for assessment metadata.",
              "Create public issues only after review and retain stable roadmap IDs in their bodies."
            ]
          },
          "effort": {
            "size": "S",
            "personDays": {
              "minimum": 2,
              "maximum": 3
            },
            "confidence": "high",
            "drivers": "The required states and identifiers are already defined; the remaining work is review policy and issue synchronization."
          },
          "ownerKinds": [
            "maintainer",
            "release-owner"
          ],
          "dependsOn": [
            "roadmap.v1-00.publication-rebaseline"
          ],
          "deliverables": [
            "Roadmap review and change policy",
            "GitHub issue synchronization convention"
          ],
          "acceptanceCriteria": [
            "Importance, risk, effort, scope, and status changes require an ordinary reviewed pull request.",
            "A roadmap item has at most one canonical public tracking issue after issue materialization.",
            "Closing an issue cannot by itself mark release evidence passed."
          ]
        },
        {
          "id": "roadmap.v1-00.beta-gap-baseline",
          "title": "Map the deferred beta gaps",
          "summary": "Compare the public support record, the full beta ledger, and exact retained results so every unproven hardening area has one v1 owner.",
          "status": "proposed",
          "releaseRequirement": "required",
          "condition": null,
          "executionKind": "evidence",
          "importance": {
            "level": "critical",
            "rationale": "The public beta intentionally deferred several failure, isolation, value, contention, repeat, and soak aggregates that must not disappear before stability."
          },
          "risk": {
            "level": "high",
            "summary": "A deferred beta check can be mistaken for an optional enhancement, leaving a correctness or isolation gap in the stable release.",
            "domains": [